prefecture,CITY,SCHOOL NAME,ENTRANCE MONTH,ADDRESS,TEL,URL,EMAIL
Fukuoka,Onojo,Shunki Language Institute,4・10,"3-2-10 Mikasagawa, Onojo-shi, Fukuoka 816-0912",+81-92-504-7051,http://www16.ocn.ne.jp/~syunki/,syunki@muse.ocn.ne.jp
Fukuoka,Munakata,Sakura Japanese Language Academy,4・10,"3-16-1 Jiyugaoka, Munakata-shi, Fukuoka 811-4163",+81-940-39-9855,http://www.j-sakura.net/,japan@j-sakura.net
Fukuoka,Itoshima,Japan Institute of Japanese Language and Culture,4・10,"3-12-29 Maebaruchuo, Itoshima-shi, Fukuoka 819-1116",+81-92-324-1002,http://www.itokoku.com/jilc/,jilcjp@sur.bbiq.jp
Oita,Oita,Asuka Beauty Culture College Japanese Department,4・10,"1-3-17 Higashi Ohmichi, Oita-shi, Oita 870-0823",+81-97-544-9114,http://www.asuka.ac.jp/,nihongo@asuka.ac.jp
Oita,Oita,Nippon Bunri University Japanese Language Institute,4・10,"1727-162 Oaza Ichigi, Oita-shi, Oita 870-0397",+81-97-524-2718,http://www.nbu.ac.jp/,kokusai@nbu.ac.jp
Oita,Beppu,Beppu University the Japanese Language Course,4・10,"6-kumi, Sakuragaoka, Beppu-shi, Oita 874-0915",+81-977-27-7070,http://www.beppu-u.ac.jp/,-
Nagasaki,Nagasaki,Nagasaki Institute of Applied Science Japanese Language Course,4,536 Aba Machi Nagasaki 851-0193,+81-95-838-5591,http://www.bekka.nias.ac.jp/,webmaster@bekka.nias.ac.jp
Nagasaki,Nagasaki,Nagasaki Information Business College,4・10,"4-25 Daikoku-machi, Nagasaki-shi, Nagasaki 850-0057",+81-95-820-5569,http://www.nibc.ac.jp/,info@nibc.ac.jp
Saga,Saga,Saga Women’s Junior College,4,"1313 Honjo, Honjo-machi, Saga-shi, Saga 840-8550",+81-952-23-5145,http://www.asahigakuen.ac.jp/sajotan/,-
Saga,Saga,KURUME SEMINAR JAPANESE LANGUAGE COURCE SAGA SCHOOL,4・10,"4-2-10 Jinno-Higashi, Saga-shi, Saga 840-0804",+81-952-97-7051,http://www.kusemi.ac.jp/nihongo/,saga-nihongo@kusemi.ac.jp
Saga,Tosu,CODO International College,4・10,"577 Tashirohoka-machi, Tosu-shi, Saga 841-0016",+81-942-81-5075,http://www.codoi.com/,info@codoi.com
Miyazaki,Miyazaki,MIYAZAKI INFORMATION BUSINESS COLLEGE,4・10,"1-3-7 Oimatsu, Miyazaki-shi, Miyazaki 880-0801",+81-985-22-1030,http://www.miyajobi.ac.jp/,college@msg.ac.jp
Kumamoto,Kumamoto,KYUSHU SURVEYING COLLEGE : JAPANESE COURCE,4,"7-36-80 Tatsuda, Kumamoto-shi, Kumamoto 861-8006",+81-96-338-7417,http://www.kyu-soku-sen.ac.jp/,qsokusen@aaanet.or.jp
Kumamoto,Kumamoto,Kumamoto Technical College Japanese Course,4・10,"5-1-1 Nagamine-higashi, Kumamoto-shi, Kumamoto 861-8038",+81-96-380-8645,http://www.kumakosen.jp/gakka/japanese.html,kumasen@sysken.or.jp
Kumamoto,Kumamoto,Kumamoto YMCA College Japanese Department,4・10,"2-1-11 Obiyama, Kumamoto-shi, Kumamoto 862-0924",+81-96-382-6661,http://www.kumamoto-ymca.or.jp/nihongo/,nihongo@kumamoto-ymca.or.jp
Kumamoto,Kumamoto,Cotocollege Tojinmachikou,4・10,"8-2 Kamikajiyamachi, Kumamoto-shi, Kumamoto 860-0021",+81-96-351-1001,http://www.coto.ac.jp/,nihongo@coto.ac.jp
Kumamoto,Kumamoto,Sojo University Language Course,4・10,"4-22-1 Ikeda, Kumamoto-shi, Kumamoto 860-0082",+81-96-326-3111,http://www.sojo-u.ac.jp/site/view/index.jsp,bekka@ofc.sojo-u.ac.jp
Kagoshima,Kagoshima,Kyusyu Japanese Language School (KLS),4・10,"3-6 Yanagi-machi, Kagoshima-shi, Kagoshima 892-0819",+81-99-222-6616,http://kyushunihongo.weebly.com/,kyushu.nihongo@gmail.com
Kagoshima,Ichikikushikino,Kamimura Gakuen Vocational College,4・10,"4460 Shimonmyo, Ichikikushikino-shi, Kagoshima 896-8686",+81-996-21-2070,http://www.kamimura.ac.jp/school_info/ot/,nihongo1956@kamimura.ac.jp
Okinawa,Naha,Japanese Cultural Stuby Academy,4・10,"2‐11‐13 Kume, Naha-City, Okinawa 900-0033",+81-98-862-0045,http://www.japan-culture-school.com/,info@japan-culture-school.com
Okinawa,Naha,Japan Institute of Culture and Economics,4・10,"2-12-14 Nishi, Naha-shi, Okinawa 900-0036",+81-98-869-8686,http://www.jice.co.jp/,japan@jice.co.jp
Okinawa,Naha,International Center of Language and Culture ICLC Institute of Japanese Language,4・10,"Sunhills Tabaru 2F, 1-4-1 Tabaru, Naha-shi, Okinawa 901-0156",+81-98-859-3881,http://www.iclcjapan.com/,info@iclcjapan.com
Okinawa,Naha,Okinawa University Japanese Language Program for International Students,4・10,"555 kokuba, Naha, OKINAWA 902-8521",+81-98-832-3269,http://www.okinawa-u.ac.jp/,-
Okinawa,Naha,Nichia Foreign Language Academy,4・10,"1-1-1 Matsugawa, Naha-shi, Okinawa 902-0062",+81-98-833-8666,http://orange.zero.jp/nichia/,nichia@orange.zero.jp
Okinawa,Ginowan,Cross Cultural Communication Center Annexed Japanese School,4・7・10,"4-13-8 Nagata, Ginowan-shi, Okinawa 901-2212",+81-98-893-6467,http://www.e-cccc.com/,info@e-cccc.com
Okinawa,Urasoe,JSL Nippon Academy,4・7・10・1,"1-1-1 Nakanisi, Urasoe-shi, Okinawa 901-2125",+81-98-875-1456,http://www.jslnippon.jp/index.jsp,askjsl@jslnippon.jp
