prefecture,CITY,SCHOOL NAME,ENTRANCE MONTH,ADDRESS,TEL,URL,EMAIL
Aichi,Aichi,Aichi Shukutoku University Center for Japanese Language and Culture,9,"9, Nagakute Katahira, Nagakute-cho, Aichi-gun, Aichi Prefecture, 480-1197",+81-561-63-7737,http://www.aasa.ac.jp/guidance/index.html,-
Gifu,Gifu,International Study Institute Chukyo,4・10・1,"2-62 Chayashinden, Gifu-shi, Gifu 501-6135",+81-58-270-0515,http://www.isi-education.com,isichukyo@isi-education.com
Gifu,Gifu,ToBuCo Specialized Training Colleges,4・10,"1-20 Fukiagecho, Gifu-shi, Gifu 500-8326",+81-58-253-5888,tp://www.tobuco.ac.jp,tobuco@he.mirai.ne.jp
Gifu,Gifu,HOTSUMA INTERNATIONAL SCHOOL,4・10,"4-20-12 Usaminami, Gifu-shi, Gifu-Ken 500-8367",+81-58-276-3376,http://www.hotsuma-group.com,fo@hotsuma-group.com
Gifu,Ogaki,Gifu Keizai University,4,"5-50 Kitagata-cho Ogaki-shi, Gifu Prefecture, Japan 503-8550",+81-584-77-3511,http://www.gifu-keizai.ac.jp/academics/foreign_student/index.html,nyuushi@gifu-keizai.ac.jp
Gifu,Seki,Chubu Gakuin University ＆ College,4,"2-1 Kirigaoka, Seki-shi, Gifu 501-3993",+81-575-24-2211,http://www.chubu-gu.ac.jp/index.html,-
Gifu,Nakatugawa,Chukyo Gakuin University,4・9,"1-104 Sendanbayashi, Nakatugawa-shi, Gifu 509-9195",+81-573-66-3121,http://www.chukyogakuin-u.ac.jp/,-
Gifu,Hashima,Liberty International School,4・10,"5-14 Hirakata, Fukuju-cho, Hashima-shi, Gifu 501-6257",+81-58-397-0330,http://www.anschool.net/,anlan@wb3.so-net.ne.jp
Gifu,Mizuho,Asahi University Japanese Language and Culture Course,4・9,"1851 Hozumi, Mizuho-city,Gif prefecture 501-0296",+81-58-329-1088,http://www.asahi-u.ac.jp/,nyuusi@alice.asahi-u.ac.jp
Gifu,Motosu,Subaru Language School,4・7・10,"1963, Kamimakuwa, Motosu shi, Gifu 501-0461",+81-58-260-9001,http://www.nihongo-subaru.com/,info@nihongo-subaru.com
Gifu,Kamo,NAKANIHON AUTOMOTIVE COLLEGE,4・9,"1301 Fukagaya Sakahogi-cho, Kamogun, Gifu 505-0077",+81-574-26-7121,http://www.nakanihon.ac.jp/index.html,-
Shizuoka,Shizuoka,International Language Institute,4・10,"3-2-28 Yahata, Suruga-ku, Shizuoka-shi, Shizuoka 422-8076",+81-54-284-8383,http://kotoba.ac.jp,info@kotoba.ac.jp
Shizuoka,Shizuoka,izuoka Japanese Education Center,4・10,"11-6 Yokota-cho, Shizuoka-shi, Shizuoka 420-0835",+81-54-251-5211,http://www18.ocn.ne.jp/~nicyuu/,nihongo_sjec@river.ocn.ne.jp
Shizuoka,Shizuoka,Shizuoka International School,4・10,"3-47-3 Sena, Aoi-ku, Shizuoka-shi, Shizuoka 420-0911",+81-54-262-1120,http://www.sins.co.jp,sinss@sins.co.jp
Shizuoka,Hamamatsu,Lles Language Institute,4・10,"15-10 Shimoikegawa-cho, Hamamatsu-shi, Shizuoka 430-0905",+81-53-473-5437,-,-
Shizuoka,Hamamatsu,OISCA COLLEGE FOR GLOBAL COOPERATION,4・10,"5815 Wajicho, Hamamatsu-shi, Shizuoka 431-1115",+81-53-486-5770,http://www.oisca.ac.jp,sengaku@oisca.ac.jp
Shizuoka,Fujinomiya,A.C.C. International Culture College,4・10,"10-9 Omiya-cho, Fujinomiya-shi, Shizuoka 418-0066",+81-544-24-8828,http://www2.tokai.or.jp/acc/,acc.college@tokai.or.jp
Shizuoka,Fuji,FUJI TOKOHA UNIVERSITY,4,"325 Obuchi, Fuji-shi, Shizuoka 417-0801",+81-545-36-1133,http://www.fuji-tokoha-u.ac.jp/info/NOD92/1150.html,-
Shizuoka,Fukuroi,Shizuoka International Language School,4・10,"2331-1 Moroi, Fukuroi-shi, Shizuoka 437-1121",+81-538-23-7788,http://www4.tokai.or.jp/sils/,sils@ai.tnc.ne.jp
Niigata,Niigata,"Airline, International and Resort College",4・10,"790 Sanban-cho, Nishibori-dori, Chuo-ku, Niigata-shi, Niigata 951-8061",+81-25-227-6335,http://www.nsg.gr.jp/air/japanese/,kokusai-bu@nsg.gr.jp
Ishikawa,Kanazawa,Alice International College,4・10,"8-50 Enkoji Honmachi, Kanazawa-shi, Ishikawa 921-8176",+81-76-280-1001,http://www.alice.ac.jp,info@alice.ac.jp
Ishikawa,Kanazawa,Hokuriku University Japanese Language Course for International Students,4,"1-1 Taiyogaoka, Kanazawa-shi, 920-1180",+81-76-229-2626,http://www.hokuriku-u.ac.jp/jlc/index.html,-
Ishikawa,Hakusan,Kinjo College,,"1200 Kasama-machi, Hakusan-shi, Ishikawa 924-8511",+81-76-276-4411,http://www.kinjo.ac.jp/ku/outline/abroad.html,kinjo@kinjo.ac.jp
Nagano,Nagano,Ngano Heiseigakuen Japanese Language Course,4・10,"1-31ARCS, Nagano-shi, Nagano 380-0918",+81-26-224-8383,http://www.heisei.ac.jp/nihongoka/,takizawa@heisei.ac.jp
Nagano,Nagano,Nagano 21 Japanese Language School,4・10,"1318 Hara, Kawanakajima, Nagano-shi, Nagano 381-2224",+81-26-283-5435,http://www4.ocn.ne.jp/~nagano21/,21j@nitp.or.jp
Nagano,Matsumoto,Marunouchi College of Business,4・10,"Josei 1-3-30, Matsumoto-shi, Nagano 390-0875",+81-263-32-5589,http://www.marubi.ac.jp,office@marubi.ac.jp
Nagano,Ueda,MANABI Japanese Language Institute,4・7・10・1,"Hotei Bldg. 6F, 1-11-7 Kotobashi, Sumida-ku, Tokyo 130-0022",+81-3-5624-5999,http://www.manabi.co.jp,info-tokyo@manabi.co.jp
Nagano,Ueda,Nagano Language College,4・10,"3-5-18 Chuo, Ueda-shi, Nagano 386-0012",+81-268-23-7220,http://www.isi.ac.jp,nlc@isi.ac.jp
Nagano,Suwa,Nagano International Culture College,4・7・10・1,"445-2 Toyoda, Suwa-shi, Nagano 392-0016",+81-266-53-8155,http://www.nicc-nagano.jp/,info@nicc-nagano.jp
Toyama,Toyama,Toyama International Academy,4・10,"4-22 Shimoshin-machi, Toyama-shi, Toyama 930-0804",+81-76-441-9360,http://www.h2.dion.ne.jp/~toyamaia,toyamaia@h6.dion.ne.jp
Toyama,Imizu,Toyama College Of Business and Information Technology,4・10,"576 Sanga, Imizu-shi, Toyama 939-0341",+81-766-55-1420,http://www.bit.urayama.ac.jp,bit@te.urayama.ac.jp
Mie,Tsu,Mie Japanese Language Institute,4・10,"5-21 Marunouchiyoseicho, Tsu-shi, mie 514-0036",+81-59-227-8222,http://mienihongo.com,nu3kitaro@nifty.com
Mie,Suzuka,MIEBUNKA JAPANESE LANGUAGE SCHOOL,4・10,"10-15 Shirokoekimae, Suzuka-shi, Mie 510-0241",+81-59-388-4488,-,-
Mie,Yokkaichi,Yokkaichi Japanese Language School,4・10,"7-3 Nishimachi, Yokkaichi-shi, Mie 510-0089",+81-59-352-1751,-,yjls@cty-net.ne.jp
Osaka,Osaka,Bunrin Institute (Department of the Japanese Language),4・10,"1-5-20 Oji-cho, Abeno-ku, Osaka-shi, 545-0023",+81-6-6627-2526,http://www.nagata-g.co.jp/bunrin/,bunrin@par.odn.ne.jp
Osaka,Osaka,"Ehle Network Communication College, Japanese Language School",4・10,"3-8-17 Namba-Naka, Naniwa-ku, Osaka-shi, Osaka 556-0011",+81-6-6647-0018,http://www.ehle.ac.jp/jls/english/index.html,http://www.ehle.ac.jp/mail_form/jls_inquiry_eng.html
Osaka,Osaka,Ashiya Kokusai Gakuin,4・10,"1-7-1 Terada-cho, Tennoji-ku, Osaka-shi, Osaka 543-0045",+81-6-6770-2857,-,ashiyakokusai@kansai.email.ne.jp
Osaka,Osaka,International Japanese Language School,4・10,"3-6-21 Bainan, Nishinari-ku, Osaka-shi, Osaka 557-0033",+81-6-6651-2122,http://nihongo.sakura.ne.jp,info@nihongo.sakura.ne.jp
Osaka,Osaka,ECC Kokusai College of Foreign Languages Japanese Course,4・10,"2-1-6 Nakazaki-nishi, Kita-ku, Osaka-shi, Osaka 530-0015",+81-6-6311-1448,http://www.ecc.ac.jp/japan/,nihongo@ecc.co.jp
Osaka,Osaka,"Seifu Institute of Information Technology, Iseifu Japanese Language School",4・10,"1-6-3 Maruyamadouri, Abeno-ku, Osaka-shi, Osaka 545-0042",+81-6-6657-2369,http://www.i-seifu.jp,language@i-seifu.jp
Osaka,Osaka,Meric Japanese Language School,4・10,"Meric Bldg., 1-10-6 Nipponbashi-higashi, Naniwa-ku, Osaka-shi, Osaka 556-0006",+81-6-6646-0330,http://www.meric.co.jp/,jp@meric.co.jp
Osaka,Osaka,ARC Academy Osaka School,4・7・10・1,"1-2-25 Nihonbashi-nishi, Naniwa-ku, Osaka-shi, Osaka 556-0004",+81-6-6635-1735,http://jp.arc-academy.net/,osaka@arc-academy.co.jp
Osaka,Osaka,Human Academy Japanese Language School Osaka,4・7・10・1,"Midosuji MID Bldg. 9F, 4-3-2 Minamisenba, Chuo-ku, Osaka-shi, Osaka 542-0081",+81-6-6282-6098,http://hajl.athuman.com,ojp22@athuman.com
Osaka,Osaka,Japan-China Language Academy,7・10・1,"Marusan Bidg., 2-2-26 Tenjinbashikita, Kita-ku, Osaka-shi, 530-0041",+81-6-6353-2442,http://www.jclc.jp,nicchu-jp@jclc.jp
Osaka,Osaka,Japanese Communication International Education School,4・7・10,"1-1-3 Itachibori, Nishi-ku, Osaka-shi, Osaka 550-0012",+81-6-6532-7480,http://jcom-ies.co.jp/,info@jcom-ies.co.jp
Osaka,Osaka,Kansai College of Business  and  Languages Dept. of Japanese Studies,4・10,"2-9-36 Matsuzaki-cho, Abeno-ku, Osaka-shi, Osaka 545-0053",+81-6-6621-8115,http://www.tg-group.ac.jp/nihongo/,nihongo@tg-group.ac.jp
Osaka,Osaka,Kansai Kokusai Gakuin,4・10,"6F, 11-7 Higashikouzu-cho, Tennoji-ku, Osaka-shi, Osaka 543-0021",+81-6-6764-0102,http://kkg.comto.net/index-eng.html,kkg@comto.net
Osaka,Osaka,Nihon Riko-Jyoho Institute of Science and Engineering,4・10,"1-1-25 Osumi, Higashi-yodogawa-ku, Osaka-shi, Osaka 533-0015",+81-6-6329-6553,http://www.kamei.ac.jp,info@kamei.ac.jp
Osaka,Osaka,Nissei Nihongo Gakuen,4・10,"4-15-26 Tatsumi-kita, Ikuno-ku, Osaka-shi, Osaka 544-0004",+81-6-6757-4669,http://nissei.ac/,info@nissei.ac
Osaka,Osaka,One Purpose International Academy,4・10,"3-6-18 Daito-cho, Miyakojima-ku, Osaka-shi, Osaka 543-0002",+81-6-6921-0055,http://www.one-purpose.co.jp,info@one-purpose.co.jp
Osaka,Osaka,Osaka College of Foreign Languages,,"2-3-10 Otedori, Chuo-ku, Osaka-shi, Osaka 540-0021",+81-6-6944-1061,http://www.osakagaigo.ac.jp/,-
Osaka,Osaka,Osaka College of High Technology,4・10,"1-2-43 Miyahara, Yodogawa-ku, Osaka-shi, Osaka 532-0003",+81-6-6392-8119,http://www.osaka-hightech.ac.jp,jpn@osaka-hightech.ac.jp
Osaka,Osaka,Osaka International Language Institute,4・10,"1-29-2 Nishi-Kujo, Konohana-ku, Osaka-shi, Osaka 554-0012",+81-6-6463-3956,http://www.inter-edu.co.jp/,i-edu@leto.eonet.ne.jp
Osaka,Osaka,Osaka International School of Culture and Language,4・7・10,"2-11-12 Doshin, Kita-ku, Osaka-shi, Osaka 530-0035",+81-6-6882-1435,http://www.415931.com,bunka@415931.com
Osaka,Osaka,Osaka Japanese Language Education Center Japan Student Services Organization,4・10,"8-3-13 Uehonmachi, Tennoji-ku, Osaka-shi, Osaka 543-0001",+81-6-6774-0033,http://www.jasso.go.jp/objec/indx.html,info-oskn@jasso.go.jp
Osaka,Osaka,Osaka Minami Japanese Language School,4・10,"5-2-38 Kire, Hirano-ku, Osaka-shi, Osaka 547-0027",+81-6-4306-4000,http://www.osaka-minami.com/,info@osaka-minami.com
Osaka,Osaka,Osaka YMCA Gakuin,4・7・1,"1-3 Ikutamatera-machi, Tennoji-ku, Osaka-shi, Osaka 543-0073",+81-6-6779-8364,http://www.osakaymca-jls.org,info-jp@osakaymca.or.jp
Osaka,Osaka,Osaka YMCA International College,4・10,"1-5-6 Tosabori, Nishi-ku, Osaka-shi, Osaka 550-0001",+81-6-6441-9068,http://www.osk-ymca-intl.ed.jp/nihongo/index.html,tosabori-nihongo@osakaymca.or.jp
Osaka,Osaka,Osaka YWCA College,4・10,"11-12 Kamiyama-cho, Kita-ku, Osaka-shi, Osaka 530-0026",+81-6-6361-2955,http://osaka.ywca.or.jp/college/,college@osaka.ywca.or.jp
Osaka,Osaka,Umikaze Academy of Japanese,4・10,"1-5-7 Nakagawa-nishi, Ikuno-ku, Osaka-shi, Osaka 544-0032",+81-6-6717-7705,http://www.asia-house.jp/,ikuno-npo@asia-house.jp
Osaka,Osaka,Clover Language Institute,4・10,"Shinmachi Bldg. 4F, 1-2-13 Shinmachi, Nishi-ku, Osaka-shi, 550-0013",+81-6-6533-3072,http://www.clover-li.co.jp,info@clover-li.co.jp
Osaka,Osaka,Shin-Osaka Preparatory School Japanese Language Course,4・10,"4-11-6 Higashi-nakajima, Higashi-yodogawa-ku, Osaka-shi, Osaka 533-0033",+81-6-6323-0155,http://www.sofli.ac.jp/index.html,info@sofli.ac.jp
Osaka,Sakai,Osaka Japanese Language School,4・10,"2-74-26 Higashi-Asakayama-cho, Kita-ku, Sakai-shi, Osaka-fu, Osaka 591-8008",+81-72-251-2139,http://www.geocities.jp/osakajls/,osakajls@ybb.ne.jp
Osaka,Sakai,Daiwa Academy,4・10,"3-2-6 Nishi, Kumano-cho, Sakai-ku, Sakai-shi, Osaka 590-0947",+81-72-224-3554,http://www.daiwa-ac.jp/,info@daiwa-ac.jp
Osaka,Sakai,Shin-A International Language School,4・7・10,"1-1-6 Enomotomachi, Sakai-ku, Sakai-shi, Osaka 590-0027",+81-72-232-5166,http://www.shin-a-ils.com,shin-a.school@world.ocn.ne.jp
Osaka,Hirakata,Osaka International University School of Japanese Studies for Foreign Students,,"3-50-1 Sugi, Hirakata-shi, Osaka-fu, Osaka 573-0117",+81-72-858-9848,http://www.oiu.ac.jp/english/index.html,iec@oiu.ac.jp
Osaka,Higashiosaka,Kinki University Japanese Language Course,,"3-4-1 Kowakae, Higashiosaka-shi, Osaka, 577-8502",+81-6-6721-2332,http://www.kindai.ac.jp/kokusai/en/,isc@itp.kindai.ac.jp
Kyoto,Kyoto,Academy of Kansai Language School,4・10,"39-12 Shimokawagara-cho, Fukakusa, Fushimi-ku, Kyoto-shi, Kyoto 612-8401",+81-75-644-2005,http://www.kansaigogen.ac.jp,info@kansaigogen.ac.jp
Kyoto,Kyoto,"The Kyoto Center for Japanese Linguistic Studies, Kyoto Japanese Language School",4・10,"394-2 Higashihinotono-machi, Higashi-hairu, Ichijyodorishin-machi, Kamigyo-ku, Kyoto-shi, Kyoto 602-0917",+81-75-414-0449,http://www.kjls.or.jp/,office@kjls.or.jp
Kyoto,Kyoto,Doshisha University Center for Japanese Language and Culture the Intensive Japanese,4・9,"Imadegawadori, Jyokyo-ku, Kyoto-shi, Kyoto 602-0047",+81-75-251-3257,http://iie.doshisha.ac.jp/,ji-iie@mail.doshisha.ac.jp
Kyoto,Kyoto,Kyoto Minsai Japanese Language School,4・7・10,"69 Oiricho, Nishi-kyougoku kita, Ukyo-ku, Kyoto-shi, Kyoto 615-0881",+81-75-316-0190,http://www.kyotominsai.co.jp,office@kyotominsai.co.jp
Kyoto,Kyoto,Kyoto International Academy,4・7・10,"627-1 Kitamachi, Imadegawa-agaru, Onmaedori, Kamigyo-ku, Kyoto-shi, Kyoto 602-8392",+81-75-466-4881,http://www.kia-ac.jp,info@kia-ac.jp
Kyoto,Kyoto,Kyoto Reigaku International Academy,4・10,"513 Kamiitabashicho, Fushimi-ku, Kyoto-shi, Kyoto 612-8316",+81-75-602-0339,http://reigaku.jp,info@reigaku.jp
Kyoto,Kyoto,JCL Foreign Language School,4・10,"6-4 Fukakusa Nishiura-cho, Fushimi-ku, Kyoto-shi, Kyoto 612-0029",+81-75-644-1717,http://www.group-jcl.com,info@group-jcl.com
Kyoto,Kyoto,Kyoto Institute of Culture and Language,4・10,"21 Kamihatecho, Kitashirakawa, Sakyo-ku, Kyoto-shi, Kyoto 606-8252",+81-75-722-5066,http://www.kicl.ac.jp,kicl@kca.kyoto-art.ac.jp
Kyoto,Kyoto,Kyoto School of Computer Science Kamogawa Campus Kyoto Japanese Language Training Center,4・10,"11 Tanakashimoyanagi-machi, Sakyo-ku, Kyoto-shi, Kyoto 606-0804",+81-75-751-0555,http://www.kcg.ac.jp/KJLTC/j/index-j.htm,kjltc@kcg.ac.jp.
Kyoto,Kyoto,Kyoto University of Foreign Studies The Course in Japanese Studies for Overseas Students,,"6 Kasamecho, Nishiin, Ukyo-ku, Kyoto-shi, Kyoto 615-8558",+81-75-322-6043,http://www.kufs.ac.jp/,oips@kufs.ac.jp
Kyoto,Kyoto,Kyoto YMCA College Japanese Course,4・10,"2 Nakano-cho, Higashi-hairu, Yanaginobanba, 3-Jyo doori, Nakagyou-ku, Kyoto-shi, Kyoto, 604-8083",+81-75-255-3287,http://www.kyotoymca.or.jp/language/japanese/,education@kyotoymca.or.jp
Kyoto,Kyoto,ARC Academy KYOTO,4,"349 Gokuishi-cho, Karasuma-Nishiiru, Manjuji-dori, Shimogyo-ku, Kyoto 600-8429",+81-75-353-7566,http://jp.arc-academy.net/,kyoto@arc-academy.co.jp
Kyoto,Kyoto,Nihongo Center,4・10,"356 Tominaga-cho, Bukkoji-kudaru, Kawaramachi-dori, Shimogyo-ku, Kyoto-shi, Kyoto 600-8023",+81-75-344-3776,http://www.nihongo-center.com,info@nihongo-center.com
Kyoto,Kyoto,Ryukoku University Japanese Culture and Language Program,,"67 Tsukamotocho, Fukakusa, Fushimi-ku, Kyoto-shi, Kyoto 612-8577",+81-75-645-7898,http://www.ryukoku.ac.jp/english2/index.php,ric@ad.ryukoku.ac.jp
Kyoto,Kyoto,International Culture Center,4・10,"84 Shimouchigawara-cho, Koyama, Kita-ku, Kyoto-shi, Kyoto 603-8132",+81-75-492-8208,http://www13.plala.or.jp/ICC/,icc@zpost.plala.or.jp
Hyogo,Nishinomiya,Ashiya Kokusai Gakuin Kobe,4・10,"6-20 Tateishi-cho, Nishinomiya-shi, Hyogo 662-0943",+81-798-22-7135,,ashiyakokusai@kansai.email.ne.jp
Hyogo,Amagasaki,Osaka Education College,4・10,"661-0033 6-23, 3-chome, minamimukonosou, Amagasaki-shi, Hyogo",+81-06-4962-3570,http://www.oec-j.com/,info@oec-j.com
Hyogo,Amagasaki,Amagasaki International Japanese Language School,4・10,"2-1-2-205 Minami-Tsukaguchi-cho, Amagasaki-shi, Hyogo 661-0012",+81-6-6426-2311,http://www.nisshinkyo.org/MemberHome/B451.html,kokusain@x.age.ne.jp
Hyogo,Amagasaki,International College of Kobe-East,4・7・10・1,"1-9-8 Kuguchi, Amagasaki-shi, Hyogo 661-0977",+81-6-6499-8334,http://www.ickejp.org/,info@ickejp.org
Hyogo,Kobe,Aristo Foreign Language School,4・10,"3-5-24 Mikawaguchi-cho, Hyogo-ku, Kobe-shi, Hyogo 652-0815",+81-78-578-8882,http://www.arist-f.com/index2.html,postmaster@arist-f.com
Hyogo,Kobe,Kobe Toyo Japanese College,4・10,"110-2 Ito-machi, Chuo-ku, Kobe-shi, Hyogo 650-0032",+81-78-333-1127,http://www.jp-college.com,kobetoyo@jp-college.com
Hyogo,Kobe,Clark Foreign Language School,4・10・1,"Center Plaza Nishi-Kan 7F, 2-11-1 Sannomiya-cho, Chuo-ku, Kobe-shi, Hyogo 650-0021",+81-78-391-3411,http://www.clark.ac.jp/en/index.html,info@clark.ac.jp
Hyogo,Kobe,Kobe World Academy,4・10,"2-4-20 Nakamichidori, Hyogo-ku, Kobe-shi, Hyogo 652-0801",+81-78-576-1208,-,world824@yahoo.co.jp
Hyogo,Kobe,Kobe Institute of Computing College of Computing Japanese Language Department,4・10,"1-6-35 Yamamoto-dori, Chuo-ku, Kobe-shi, Hyogo 650-0003",+81-78-242-0014,http://www.kobedenshi.ac.jp/e/,https://www.kobedenshi.ac.jp/contact/index.php
Hyogo,Kobe,The Kobe YMCA College Japanese Department,4・10,"2-7-15 Kano-cho, Chuo-ku, Kobe-shi, Hyogo 650-0001",+81-78-241-7204,http://kbym.jp/japanese/index.html,japanese@kobeymca.or.jp
Hyogo,Kobe,Kobe Sumiyoshi International Japanese Language School,4・10,"2-21-8 Sumiyoshimiyamachi, Higashi-Nada-ku, Kobe-shi, 658-0053",+81-78-822-6620,http://www.s-i-s-kobe.com,sumiyoshi-nihongo@yacht.ocn.ne.jp
Hyogo,Kobe,The Kobe YMCA Japanese Language School,4・10,"2-1-3 Gakuenhigashi-machi, Nishi-ku, Kobe-shi, Hyogo 651-2102",+81-78-793-7402,http://kbym.jp/japanese/,kjpns@kobeymca.or.jp
Hyogo,Kobe,Kobe YWCA College,4・10・1,"1-12-10 Ninomiya-cho, Chuo-ku, Kobe-shi, 651-0093",+81-78-231-6303,http://www.kobe.ywca.or.jp/top/english,college@kobe.ywca.or.jp
Hyogo,Himeji,Himeji YMCA Japanese Language Institute,4・10,"9-15 Tsuchiyamahigashino-cho, Himeji-shi, Hyogo 670-0995",+81-79-298-5566,http://www.himeji-ymca.org/education/japanese/en/index.html,himeji@ymcajapan.org
Nara,Nara,Nara Japanese Language School,4・10,"Isokawa Bldg., 23 Hayashikoji, Nara-shi, Nara 630-8227",+81-742-23-7460,http://www.jnet.com.tw/japan/school/nara/,naranichigo_ueda@younet.co.jp
Wakayama,Wakayama,Wakayama-YMCA International College of Social Service Japanese Language Courses,4・10,"383 Oda, Wakayama-shi, Wakayama 640-8323",+81-73-473-3338,http://www.ymcajapan.org/wakayama/japanese/en/index.html,wklngage@ymcajapan.org
Wakayama,Wakayama,Wakayama College of Foreign Studies,4・10,"21 Suruga-cho, Wakayama-shi, Wakayama 640-8034",+81-73-432-8699,http://www.wfs.ac.jp/,waka-1991@vesta.ocn.ne.jp
Okayama,Okayama,Okayama Institute of Language Nihongo Ka,4・10,"2-1-77 Nakasange, Kita-ku, Okayama-shi, Okayama 700-0821",+81-86-231-5211,http://www.harenet.ne.jp/oil/,oil-main@po.harenet.ne.jp
Okayama,Kurashiki,Kurashiki University Of Science And the Arts,4・9,"264 Nishinoura Tsurajima-cho  Kurashiki-shi , Okayama 712-8505",+81-86-440-1112,http://www.kusa.ac.jp/,koho@kusa.ac.jp
Okayama,Okayama,Eisugakkan Okayama School Japanese Language Department,4・10,"1-9-1 Gakunan-cho, Kita-ku, Okayama-shi, Okayama 700-0011",+81-86-252-5012,,nihongo.okayama@eisu.ac.jp
Okayama,Okayama,Osafune Japanese Language School,4・7・10,"3-10 Banzan-cho, Kita-ku, Okayama-shi, Okayama 700-0818",+81-86-236-0881,http://www.osafune.info,info@osafune.info
Okayama,Okayama,Okayama Business College,4・10,"3-22 Iwata-cho, Kita-ku, Okayama-shi, Okayama 700-0022",+81-86-801-5007,http://www.obcnet.ac.jp,nihongo@obcnet.ac.jp
Okayama,Okayama,OKAYAMA BUSINESS COLLEGE JAPANESE LANGUAGE COURSE,4・10,"8-10 Showa Kita-ku, Okayama City, Okayama Prefecture 〒 700-0032",+81-86-255-7171,http://www.oist.ac.jp/index.html,
Hiroshima,Hiroshima,Japan Wellness Sports College Hiroshima,4・10,"2-21-26-8 Nakano, Aki-ku, Hiroshima-shi, Hiroshima 739-0321",+81-82-892-3015,http://www.hiroshimawellness.jp/,
Hiroshima,Hiroshima,"Human Welfare Hiroshima College, Japanese Language Course",4・10,"3-15-38 Ushitashin-machi, Higashi-ku, Hiroshima-shi, Hiroshima 732-0068",+81-82-224-2240,http://www.human.ed.jp/,
Fukuoka,Kitakyushu,Kitakyushu YMCA Science and Engineering Course Japanese Department,4・10,"2-3-9 Kaji-machi, Kokurakita-ku, Kitakyushu-shi, Fukuoka 802-0004",+81-93-531-1587,http://www.k-ymca.or.jp/,kitakyushu@ymcajapan.org
Fukuoka,Kitakyushu,Kyushu International University Japanese Language Course,4・10,"1-6-1 Hirano, Yahatahigashi-ku, Kita-Kyushu-shi, Fukuoka 805-8512",+81-93-662-8338,http://www.kiu.ac.jp/faculty/learnjapanese/index.html,nihongo_course@kiu.ac.jp
Fukuoka,Kitakyushu,Subaru Automobile Engineering College Japanese Department,4・10,"1-1-1 Miyano-machi, Yahatahigashi-ku, Kitakyushu-shi, Fukuoka 805-0023",+81-93-651-5500,http://www.subaru.ac.jp/,ma@subaru.ac.jp
Fukuoka,Kitakyushu,Kitakyushu YMCA Japanese Language School,4・10,"2-3-9 Kaji-machi, Kokurakita-ku, Kitakyushu-shi, Fukuoka 802-0004",+81-93-531-1587,http://www.k-ymca.or.jp/,kitakyushu@ymcajapan.org
Fukuoka,Fukuoka,Aiwa Language School,4・7・10,"AIWA Bldg., 1-15-37 Maidashi, Higashi-ku, Fukuoka-shi, Fukuoka 812-0054",+81-92-632-6748,http://www.aiwa.ne.jp/,japan@aiwa.ne.jp
Fukuoka,Fukuoka,Asia Japanese Academy,4・10,"4-2-29 Nagazumi, Minami-ku, Fukuoka-shi, Fukuoka 811-1362",+81-92-557-8667,http://www.a-j-academy.jp/,2101@a-j-Academy.jp
Fukuoka,Fukuoka,Aso Foreign Language Tourism and Patissier College,4・10,"1-14-17 Hakataeki-Minami, Hakata-ku, Fukuoka-shi, Fukuoka 812-0016",+81-92-415-2293,http://www.asojuku.ac.jp/international/,nihongo@asojuku.ac.jp
Fukuoka,Fukuoka,Aso College Of Automotive Engineering And Technology,4・10,"2-8-28 Higashihie, Hakata-ku, Fukuoka-shi, Fukuoka 812-0007",+81-92-433-0633,http://www.asojuku.ac.jp/international/,nihongo@asojuku.ac.jp
Fukuoka,Fukuoka,ASO BUSINESS COMPUTER COLLEGE,4・10,"2-12-32 Hakataekiminami, Hakata-ku, Fukuoka 812-0016",+81-92-415-2291,http://www.asojuku.ac.jp/international/,nihongo@asojuku.ac.jp
Fukuoka,Fukuoka,Kyushu Eisu Gakkan International Language Academy,4・10,"1-5-30 Maizuru, Chuo-ku, Fukuoka-shi, Fukuoka 810-0073",+81-92-713-5720,http://www.kyushu-eisu.ac.jp/,info@kyushu-eisu.ac.jp
Fukuoka,Fukuoka,Kyushu Japanese Language Academy,4・10,"13-35 Shimizu 2 chome, Minami-ku, Fukuoka-shi, Fukuoka 815-0031",+81-92-551-8587,http://www.k-nichigo.jp/,jzry@gaea.ocn.ne.jp
Fukuoka,Fukuoka,FUKUOKA INTERNATIONAL LANGUAGE ACADEMY,4・10,"6-2-92 Nishijin, Sawara-ku, Fukuoka 814-8511",+81-92-716-1931,http://www.seinan-gu.ac.jp/kokusai/betuka/gaiyou.html,fila@s8.dion.ne.jp
Fukuoka,Fukuoka,Fukuoka International Academy,4・10,"4-4-3 Katakasu, Hakata-ku, Fukuoka-shi, Fukuoka 812-0043",+81-92-441-1032,http://www.f-i-a.jp,info@f-i-a.jp
Fukuoka,Fukuoka,Kyushu Foreign Language Academy,4・10,"2-1 Nakagofuku-machi, Hakata-ku, Fukuoka-shi, Fukuoka 812-0035",+81-92-273-1511,http://www.jiuwai.com/jiuwai/index.php,info@jiuwai.com
Fukuoka,Fukuoka,Nishinihon International Education Institute,4・10,"4-17-17 Shiobaru, Minami-ku, Fukuoka-shi, Fukuoka 815-0032",+81-92-541-8450,http://www.niei.jp,info@niei.jp
Fukuoka,Fukuoka,Seinan Gakuin University International Division,8,"6-2-92 Nishijin, Sawara-ku, Fukuoka 814-8511",+81-92-823-3346,http://www.seinan-gu.ac.jp/kokusai/betuka/gaiyou.html,intleduc@seinan-gu.ac.jp
Fukuoka,Fukuoka,Kyushu International Education College,4・10,"Hakatakindai-Bldg 4F-B, 1-1-33JHakataekihigashi, Hakata-ku, Fukuoka-shi, Fukuoka 812-0013",+81-92-432-6188,http://www.qsintedu.com,kyushyukokusaikyoikugakuin@hotmail.com
Fukuoka,Fukuoka,Fukuoka International Communication College,4・10,"1-8-27 Maidashi, Higashi-ku, Fukuoka-shi, Fukuoka 812-0054",+81-92-631-0147,http://www.f-seikei.ac.jp/,info@f-seikei.ac.jp
Fukuoka,Fukuoka,Fukuoka Kokudo-kensetsu Technical College,4・10,"2-7-8 Sanchiku, hakata-ku, Fukuoka-shi, Hukuoka 812-0887",+81-92-501-3261,http://www.kokusen.ac.jp/kj/,kokusen@mocha.ocn.ne.jp
Fukuoka,Fukuoka,KYUSHU GENGO KYOIKU GAKUIN,4・10,"3-7-10 Ropponmatsu, Chuo-ku, Fukuoka-shi, Fukuoka 810-0044",+81-92-717-8207,http://www.kgkgedu.com/,li.ming@hotmail.co.jp
Fukuoka,Fukuoka,Fukuoka Foreign Language College,4・10,"1-8-27 Maidashi, Higashi-ku, Fukuoka-shi, Fukuoka 812-0054",+81-92-631-0147,http://www.f-seikei.ac.jp/,info@f-seikei.ac.jp
Fukuoka,Fukuoka,FUJI INTERNATIONAL ACADEMY,4・10,"13-18 Sekijo-machi, Hakata-ku, Hakata-shi, Fukuoka 812-0032",+81-92-271-6661,http://fuji-ac.jp/,info@fuji-ac.jp
Fukuoka,Fukuoka,Fukuoka Japanese Language School,4・10・1,"HakataKindai Bldg., 1-1-33 Hakata,eki-Higashi, Hakata-ku, Fukuoka-shi, Fukuoka 812-0013",+81-92-477-2393,http://www.fukuokaschool.com/,fjschool@hotmail.com
Fukuoka,Fukuoka,Fukuoka YMCA International College,4・10,"1-1-10 Nanakuma, Jonan-ku, Fukuoka-shi, Fukuoka 814-0133",+81-92-831-1771,http://www.fukuoka-ymca.or.jp/japanese/,f-j-college@ymcajapan.org
Fukuoka,Fukuoka,Fukuoka YMCA Japanese Language School,4・10,"Tenjin Asahi Bldg. 2F 3-4-7 Tenjin, Chuo-ku, Fukuoka-shi, Fukuoka 810-0001",+81-92-781-7410,http://www.fukuoka-ymca.or.jp/,f-nihongo@ymcajapan.org
Fukuoka,Kurume,Kurume Institute of International Relation,4・10,"516-1 Higashi-machi, Kurume-shi, Fukuoka 830-0032",+81-942-33-5337,-,-
Fukuoka,Kurume,Kurume University Intensive Japanese Program,4・10,"1635 Mii-machi, Kurume-shi, Fukuoka-ken 839-8502",+81-942-43-5166,http://www.kurume-u.ac.jp/,nyushi@kurume-u.ac.jp
Fukuoka,Kurume,Kurume Seminar Japanese Language Course,4・10,"2-55 Tenjin-machi, Kurume-shi, Fukuoka 830-0033",+81-942-36-6660,http://www.kusemi.ac.jp/nihongo/,nihongo_jimu@kusemi.ac.jp
Fukuoka,Kasuya,Nihongo Academy,4・10,"31-11,Ino, Umimachi, Kasuya-gun, Fukuoka-ken, 811-2104",+81-92-934-3727,http://www5.ocn.ne.jp/~academy/index_j.html,n.a3727@athena.ocn.ne.jp
Fukuoka,Kasuya,MIZUHO FOREIGN LANGUAGE SCHOOL,4・10,"1-1-72 Misaki, Shingu-machi, Kasuya-gun, Fukuoka 811-0121",+81-92-940-6877,http://www.mizuhoschool.com/,info@mizuhoschool.com
Fukuoka,Nogata,JAPAN International Education Institute,4・10,"9-27 Furumachi, Nogata-shi, Fukuoka 822-0027",+81-949-22-1111,http://www.j-iei.biz/,brickgroupoffice@ybb.ne.jp
Fukuoka,Ogori,NILS,4・10,"760-5 Ogori, Ogori-shi, Fukuoka 838-0141",+81-942-41-2611,http://www.ulearnjapanese.com/,info@nils.gr.jp
