prefecture,CITY,SCHOOL NAME,ENTRANCE MONTH,ADDRESS,TEL,URL,EMAIL
Hokkaido,Sapporo,YOSHIDAGAKUEN COMPUTER  and  BUSINESS COLLEGE DEPARTMENT OF JAPANESE LANGAGE,4・10,"Higashi 16 Kita15-jo, Higasi-ku, Sapporo, 060-0063 JAPAN",+81-11-711-6317,http://www.yoshida-jbusiness.jp/jp/,nhg@yoshida-g.ac.jp
Hokkaido,Sapporo,SOKEN INSTITUTE OF JAPANESE LANGUAGE COURSE(SJC),4・10,"1-30 Nishi4, Kita20, Kita-ku, Sapporo-shi, Hokkaido 001-0020",+81-11-757-5522,http://www6.ocn.ne.jp/~kanyobi/j/,liuliu888@kanyobi.ac.jp
Hokkaido,Sapporo,SAPPORO LANGUAGE CENTER JAPANESE COURSE,4・10,"2F Famil Nakajima Park, 3-17 Nishi 1 Minami 11-Jo, Chuo-ku, Sapporo-shi, Hokkaido 064-0811",+81-11-563-1777,http://www.sapporo-language-center.asia/jp/,toosakajls@ybb.ne.jp
Hokkaido,Sapporo,Japanese Language Institute of Sapporo,4・10・1,"26-2-7 Minami-6-Jo-Nishi, Chuo-ku, Sapporo-shi, Hokkaido 064-0806",+81-11-562-7001,http://www.jli.co.jp/,info@jli.co.jp
Hokkaido,Sapporo,INTERNATIONAL ACADEMY,4・10・1,"Hinode Bldg., 13 Nishi-4, Minami-1, Chuo-ku, Sapporo-shi, Hokkaido 060-0061",+81-11-281-5188,http://www.myiay.com/j/,info@myiay.com
Hokkaido,Eniwa,HOKKAIDO COLLEGE OF HIGH TECHNOLOGY JAPANESE DEPARTMENT,4,"2-12-1 Meguminokita, Eniwa-shi, Hokkaido 061-1396",+81-123-39-6666,http://jpn.hht.ac.jp/,toosakajls@ybb.ne.jp
Akita,Akita,Japanese Language and Culture Course at North Asia University,4,"46-1 Jimorisawa, Shimokitatesakura, Akita-shi, Akita 010-8515",+81-18-836-1981,http://www.nau.ac.jp/bekka/,
Iwate,Morioka,MORIOKA JAPANESE LANGUAGE SCHOOL,4・10・1,"3-2-17 Chuo-dori, Morioka-shi, Iwate 020-0021",+81-19-651-5530,http://www.mjls.jp/index.html,
Miyagi,Sendai,AOBA FOREIGN LANGUAGE SCHOOL,4・10,"2-16-25 Hachiman, Aoba-ku, Sendai-shi,Miyagi 980-0871",+81-22-234-6883,,
Miyagi,Sendai,Global Japanese Academy,4・10・1,"1-1-15 Tsuchitoi, Aoba-ku, Sendai-shi, Miyagi 980-0065",+81-22-726-7888,http://www.e-888.net,
Miyagi,Sendai,International Academy Language School,4,"1-5-3 Tsutsujigaoka, Miyagi-ku, Sendai-shi, Miyagi 983-0852",+81-22-298-7031,http://www.ials.jp/ials/,info@ials.jp
Miyagi,Sendai,Sendai English Center Japanese Course,4,"6F Yamaguchi Bldg., 1-1-31 Ichiban-cho Aoba-ku, Sendai-shi, Miyagi 980-0811",+81-22-221-2555,,
Miyagi,Sendai,SENDAI INTERNATIONAL SCHOOL OF JAPANESE,4・10,"1-3-1 Kakyoin, Aoba-ku, Sendai-shi, Miyagi 980-0013",+81-22-224-6509,http://www.sjls.jp/,sjls@sjls.jp
Miyagi,Sendai,SENDAI LANGUAGE SCHOOL JAPANESE COURSE,4・7・10,"Sendai Chuo Bldg 2F-4F, 4-7-2 Chuo, Aoba-ku, Sendai-shi, Miyagi 980-0021",+81-22-266-8181,http://www.sendai-lang.com/,
Miyagi,Sendai,TOHOKU FOREIGN LANGUAGE  and  TOURISM COLLEGE,4・10,"2-1-13 Itsutsubashi, Aoba-ku, Sendai-shi, Miyagi 980-0022",+81-22-263-0820,http://www.tohokugaigo.ac.jp/,nihongo@tohokugaigo.ac.jp
Miyagi,Sendai,Toyo International Culture Academy,4・10,"1-4-18 Miyamachi, Aoba-ku, Sendai-shi, Miyagi 980-0004",+81-22-398-6818,http://www.toyo-kokusai.com/,
Yamagata,Shinjyou,Shinjo Computer Academy the Course of Japanese Education,4,"6162-11 Tohkamachi, Shinjo-shi, Yamagata 996-0091",+81-233-29-2121,http://sca.core.ac.jp/?page_id=12,
Yamagata,Yamagata,TOHOKU BUNKYO COLLEGE Japanese Language Section for Foreign Students,4,"515 Katayachi, Yamagata-shi, Yamagata, 990-2316",+81-23-688-2298,http://www.t-bunkyo.jp/academics/betsu/index.html,
Fukushima,Fukushima,FUKUSHIMA JAPANESE SCHOOL,4・10,"9-28 Chugen-cho, Fukushima-shi, Fukushima 960-8105",+81-24-523-1818,http://www.hkr.co.jp/fjs/,info-fjs@hkr.co.jp
Fukushima,Iwaki,Higashi Nippon International University Intensive Japanese Language Courses For Overseas Students,4・10,"37 Kotobuki Kanasawa, Kamata-aza, Iwaki-shi, Fukushima 970-8023",+81-246-35-0410,http://www.shk-ac.jp/department/foreign/head_msg.html,
Tokyo,Shinjuku-ku,Academy of Language Arts,4・7・10,"Dai-ni Tobundo Bldg., 2-16 Ageba-cho, Shinjuku-ku, Tokyo 162-0824",+81-3-3235-0071,http://www.ala-japan.com,info@ala-japan.com
Tokyo,Shinjuku-ku,ARC Academy Shinjuku,4・7・10・1,"Toshin-Nishi-Shinjuku Bldg. 3F 7-18-16 Nishi-Shinjuku, Shinjuku-ku, Tokyo 160-0023",+81-3-5337-0166,http://www.arc-academy.net/,shinjukunishi@arc.ac.jp
Tokyo,Shinjuku-ku,ELITE Japanese Language School,4・7・10,"1-8-10 Hyakunincho, Shinjuku-ku, Tokyo 169-0073",+81-3-8232-0550,http://www.elite-japan.com,info@elite-japan.com
Tokyo,Shinjuku-ku,Fuji International Language Institute,4・7・10,"1-7-20 Kita-Shinjuku, Shinjuku-ku, Tokyo169-0074",+81-3-3368-0531,http://www.fuji-edu.jp/,info@fuji-edu.jp
Tokyo,Shinjuku-ku,"Fuji International Language Institute, Waseda",4・10,"27-3 Wasedamachi, Shinjuku-ku, Tokyo 162-0042",+81-3-3203-6996,http://www.fuji-edu.jp,info@fuji-edu.jp
Tokyo,Shinjuku-ku,Human Academy Japanese Language School Tokyo Campus,7・10・1,"Waseda Yobiko 13 -Ji Hall 7F, 4-9-9 Takadanobaba, Shinjuku-ku, Tokyo 169-0075",+81-3-5348-8951,http://hajl.athuman.com,tjp22@athuman.com
Tokyo,Shinjuku-ku,ISI Language School,7・10・1,"1-1-1 Shimo-Ochiai, Shinjuku-ku, Tokyo 161-0033",+81-3-3227-6123,info@isi-education.com,http://www.isi-education.com
Tokyo,Shinjuku-ku,International Japanese Training Center,4・10,"Yamazaki Bldg. 202, 2-10-2 Okubo, Shinjuku-ku, Tokyo 169-0072",+81-3-3208-5671,http://www.ijtc.jp/english/index.htm,info@ijtc.jp
Tokyo,Shinjuku-ku,KCP Japanese Language School,4・7・10・1,"Syoei Yotsuya Bldg., 4-25-6 Yotsuya, Shinjuku-ku, Tokyo 160-0004",+81-3-3356-3141,http://www.japanfuji.jp/,info@japanfuji.jp
Tokyo,Shinjuku-ku,"Japanese Language Institute, Nichibei Kaiwa Gakuin, International Education Center",4・7・10・1,"1-21 Yotsuya, Shinjuku-ku, Tokyo 160-0004",+81-3-3359-9600,http://www.nichibei.ac.jp/jli/,jli-info@nichibei.ac.jp
Tokyo,Shinjuku-ku,JASSO Tokyo Japanese Language Education Center,4・10,"3-22-7 Kita-Shinjuku, Shinjuku-ku Tokyo 169-0074",+81-3-3371-7267,http://www.jasso.go.jp/tokyo/index.html,koumu@jasso.go.jp
Tokyo,Shinjuku-ku,Kai Japanese Language School,4・7・10・1,"Miyuki Bldg. 3F, 1-15-18 Okubo, Shinjuku-ku, Tokyo 169-0072",+81-3-3205-1356,http://www.kaij.jp,admission@kaij.co.jp
Tokyo,Shinjuku-ku,KCP International Language Institute,7・10,"KCP the main Bldg., 1-29-12 Shinjuku, Shinjuku-ku, Tokyo 160-0022",+81-3-3356-2359,http://www.kcp.ac.jp,info@kcp.ac.jp
Tokyo,Shinjuku-ku,Labo Japanese Language Institute,7・10・1,"Narukozaka haitsu 2F, 6-26-11 Nishi-Shinjuku, Shinjuku-ku, Tokyo 160-0023",+81-3-5908-3877,http://www.labo-nihongo.com,exchange@labo-global.co.jp
Tokyo,Shinjuku-ku,Mejiro University,-,"4-31-1 Nakaochiai, Shinjuku-ku, Tokyo 161-8539",+81-3-5996-3201,http://www.mejiro.ac.jp/eng/university/index.html,int.center@mejiro.ac.jp
Tokyo,Shinjuku-ku,MIDREAM School of Japanese Language,4・7・10・1,"2-7-11 Hyakunincho, Shinjuku-ku, Tokyo 169-0073",+81-3-3368-4931,http://midream.ac.jp/,midream2005@yahoo.co.jp
Tokyo,Shinjuku-ku,Mitsumine Career Academy Japanese Language Course,7・10・1,"Daisan Yamahiro Bldg., 4-1-1 Kita-shinjuku, Shinjuku-ku, Tokyo 169-0074",+81-3-3368-4931,http://www.mcaschool.jp,info@mcaschool.jp
Tokyo,Shinjuku-ku,HIGASHI SHINJUKU JAPANESE LANGUAGE SCHOOL,7・10・1,"West Bldg., 7-18-7 Shinjuku, Shinjuku-ku, Tokyo 160-0022",+81-3-5292-6355,http://www.nishi-tokyo-jls.com/english/index.html,wu@nishi-tokyo-jls.com
Tokyo,Shinjuku-ku,Samu Language School,7・10・1,"2-2-10 Hyakunin-cho, Shinjuku-ku, Tokyo 169-0073",+81-3-3205-2020,http://www.samu-language.com,kyomusamu@aol.com
Tokyo,Shinjuku-ku,Sendagaya Japanese Institute West Branch,4・10・1,"Shimo-Ochiai Daiwa Bldg., 1-1-29 Nakaochiai, Shinjuku-ku, Tokyo 161-0032",+81-3-3953-691,http://www.jp-sji.org/,jc@jp-sji.org
Tokyo,Shinjuku-ku,Shinjuku Gyoen Gakuin,7・10・1,"1-26-12 Shinjuku, Shinjuku-ku, Tokyo 160-0022",+81-3-3356-1161,http://www.gyoen.co.jp,shinjuku@gyoen.co.jp
Tokyo,Shinjuku-ku,Shinjuku International Exchange School,7・10・1,"1-22-25 Hyakunin-cho, Shinjuku-ku, Tokyo 169-0073",+81-3-5348-6591,http://ija-shinjuku.kohgakusha.com,skk-shinjuku@kohgakusha.com
Tokyo,Shinjuku-ku,Shinjuku Japanese Language Institute,4・10,"2-9-7 Takadanobaba, Shinjuku-ku, Tokyo 169-0075",+81-3-5273-0044,http://www.sng.ac.jp/,jimu_sng_1975@sng.ac.jp
Tokyo,Shinjuku-ku,Tokyo Cosmo Academy,4・10,"4-9-2 Takadanobaba, Shinjuku-ku, Tokyo 169-0075",+81-3-3371-2195,http://www.tokyo-cosmo.com/,info@tokyo-cosmo.com
Tokyo,Shinjuku-ku,Tokyo ELS Japanese Language School,7・10・1,"Okubo Station, Shin-Okubo Station, Shinjuku Station, Higashi-Shinjuku Station",+81-3-5273-0701,http://www.tokyoels.co.jp/,els@yacht.ocn.ne.jp
Tokyo,Shinjuku-ku,Tokyo Foreign Language College,1・4,"7-3-8 Nishi-Shinjuku, Shinjuku-ku, Tokyo 160-0023",+81-3-3367-1181,http://www.tflc.ac.jp/,ryugaku@tflc.ac.jp
Tokyo,Shinjuku-ku,Tokyo International Japanese School,4・10・1,"2-13-6 Shinjuku, Shinjuku-ku, Tokyo 160-0022",+81-3-3350-9761,http://www.tijs.jp,info@tijs.jp
Tokyo,Shinjuku-ku,Japanese Language School Affiliated with Tokyo International University,4・10,"1-32-14 Takadanobaba, Shinjuku-ku, Tokyo 169-0075",+81-3-3205-8101,http://www.jpschool.ac.jp,jp@jpschool.ac.jp
Tokyo,Shinjuku-ku,Tokyo World Language Academy,7・10・1,"Kita-Shinjuku OC Bldg., 1-8-15 Kita-Shinjuku, Shinjuku-ku, Tokyo 169-0074",+81-3-5332-3531,http://twla.jp,twla21@yahoo.co.jp
Tokyo,Shinjuku-ku,UNITAS Japanese Language School Tokyo,7・10・1,"Sankyo Bldg. 2F, 2-2-9 22 Okubo, Shinjuku-ku, Tokyo 169-0072",+81-3-5287-5636,http://www.unitas-ej.com,japanese-tokyo@unitas-ej.com
Tokyo,Shinjuku-ku,Waseda Foreign Language College,4・10,"1-23-9 Takadanobaba, Shinjuku-ku, Tokyo 169-0075",+81-3-3208-8801,http://www.waseda-flc.ac.jp/,waseda.flc.ac.jp@gmail.com
Tokyo,Shinjuku-ku,"Waseda University, Intensive Japanese Language Program",4・9,"1-7-14 Nishi-Waseda, Shinjuku-ku, Tokyo 169-8050",+81-3-5273-3142,http://www.waseda.jp/cjl/html/e_study.index.html,-
Tokyo,Shinjuku-ku,Yohan Japanese Language School,7・10・1,"4-41-1 Takadanobaba, Shinjuku-ku, Tokyo 169-0075",+81-3-3365-6171,http://www.yohanschool.com,yohanschool@hotmail.com
Tokyo,Shinjuku-ku,Yoshida Institute of Japanese Language,7・10・1,"1-23-14 Nishi-Waseda, Shinjuku-ku, Tokyo 169-0051",+81-3-3202-0828,http://yosida.com,yosida@yosida.com
Tokyo,Shinjuku-ku,YU Language Academy,7・10・1,"Palace Bldg., 2-16-25 Ookubo, Shinjuku-ku, Tokyo 169-0072",+81-3-3209-0160,http://www.yula.jp,info@yula.jp
Tokyo,Shinjuku-ku,Japan Tokyo International School,4・7・10・1,"5F 2-7-19 Ichigaya Sadohara-cho, Shinjuku-ku, Tokyo 162-0842",+81-3-3857-6711,http://www.nihongo-ac.jp,nk-jtis@f3.dion.ne.jp
Tokyo,Shinjuku-ku,YU Language Academy,7・10・1,"Palace Bldg., 2-16-25 Ookubo, Shinjuku-ku, Tokyo 169-0072",+81-3-3209-0160,http://www.yula.jp,info@yula.jp
Tokyo,Shibuya-ku,Hiroo Japanese Center,4・7・10・1,"Palacion Hiroo Bldg. 402, 5-19-2 Hiroo, Shibuya-ku, Tokyo 150-0012",+81-3-3444-3481,http://www.japaneselanguage.net,hjc@cb.wakwak.com
Tokyo,Shibuya-ku,Aoyama School of Japanese,7・10・1,"1-5-5 Tomigaya, Shibuya-ku, Tokyo 151-0063",+81-3-3465-9577,http://www.aoyamaschool.com/,mail@aoyamaschool.com
Tokyo,Shibuya-ku,ARC Academy Shibuya School,4・7・10・1,"2-14-7 Shibuya, Shibuya-ku, Tokyo 150-0002",+81-3-3409-1057,http://www.arc-academy.net/,tokyo@arc.ac.jp
Tokyo,Shibuya-ku,OLJ Language Academy,4・7・10,"Nippon-Fudo Bldg., 2-1-13 Shibuya, Shibuya-ku, Tokyo 150-0002",+81-3-3400-7181,http://www.learning-japanese.jp,info@learning-japanese.jp
Tokyo,Shibuya-ku,Yamano Japanese Language School,4・10,"3-10-6 Sendagaya, Shibuya-ku, Tokyo 151-0051",+81-3-5772-5112,http://www.yamano.jp,info@yamano-js.jp
Tokyo,Shibuya-ku,Bunka Institute of Language,4・10,"3-22-1 Yoyogi, Shibuya-ku, Tokyo 151-8521",+81-3-3299-2011,http://www.bunka.ac.jp/bil/bil-hp.htm,bil@bunka.ac.jp
Tokyo,Shibuya-ku,Tokyo Central Japanese Language School,7・10・1,"4-30-3 Sendagaya, Shibuya-ku, Tokyo 151-0051",+81-3-5411-3331,http://www.tcj-nihongo.com,info@tcj-nihongo.co.jp
Tokyo,Shibuya-ku,Shibuya Language School,4・7・10・1,"8-18 Sakuragaoka-cho, Shibuya-ku, Tokyo 150-0031",+81-3-3461-8854,http://www.shibuya-gaigo.com/sls2/outline/index.html,nihongo@shibuya-gaigo.com
Tokyo,Shibuya-ku,The Tokyo School of the Japanese Language,4・10,"16-26 Nanpeidai-cho, Shibuya-ku, Tokyo 150-0036",+81-3-3463-7261,http://www.naganuma-school.ac.jp/index.html,http://www.naganuma-school.ac.jp/contact/form.html
Tokyo,Shibuya-ku,Tokyo Kogakuin Japanese Language School,4・7・10,"5-30-16 Sendagaya, Shibuya-ku, Tokyo 151-0051",+81-3-3352-3851,http://www.technos-jpschool.ac.jp/,info@technos-jpschool.ac.jp
Tokyo,Minato-ku,Aoyama International Education Institute Japanese Language Center,7・10・1,"Aoyama Center Bldg. 3F, 3-8-40 Minami-Aoayama, Minato-ku, Tokyo 107-0062",+81-3-3403-3186,http://www.aoyama-international.com/,info@aoyama-international.com
Tokyo,Minato-ku,Kokusai Zenrin Gakuin,4・10,"1-5-5 Shinbashi, Minato-ku, Tokyo 105-0004",+81-3-3573-3065,http://www.kokusaizenrin.com/,info@kokusaizenrin.com
Tokyo,Minato-ku,"Kazankai Foundation The Toa Language Institute, the",4・10,"Akasaka Kazan Bldg. 3F, 2-17-47 Akasaka, Minato-ku, Tokyo 107-0052",+81-3-5575-6303,bosyu@kazankai.org,http://toagakuin..kazankai.org/
Tokyo,Minato-ku,UJS Language Institute,7・10・1,"3-3-29 Roppongi, Minato-ku, Tokyo 106-0032",+81-3-5545-6941,http://ujsli.jp,info@ujsli.jp
Tokyo,Minato-ku,Edo Cultural Center,7・10・1,"7-10-9 Akasaka, Minato-ku, Tokyo 107-0052",+81-3-3589-0202,http://www.edocul.com,edo@edocul.com
Tokyo,Minato-ku,Tokyo Galaxy Language Academy,7・10・1,"5-10-10 Shiba, Minato-ku, Tokyo 108-0014",+81-3-5765-2805,http://www.tokyo-galaxy.com,info@tokyo-galaxy.com
Tokyo,Minato-ku,Tokyo Shibaura Institute of Foreign Language,4・10,"UP Chuo Tohuku Bldg., 3-1-12 Kaigan, Minato-ku, Tokyo 108-0022",+81-3-5232-2285,http://www.tokyoshibaura.com/,tokyoshibaura21@yahoo.co.jp
Tokyo,Minato-ku,Tokyo Japanese Language Center,4・7・10,"3-5-4 Shiba-Koen, Minato-ku, Tokyo 105-0011",+81-3-3433-3378,http://www.tjlc.jp,info@tjlc.jp
Tokyo,Minato-ku,"Keio University, Japanese Language Program of the Center for Japanese Studies",-,"2-15-45 Mita, Minato-ku, Tokyo 108-8345",+81-3-5427-1614,http://www.ic.keio.ac.jp/nncenter/index.html,ic-jlp@adst.keio.ac.jp
Tokyo,Toshima-ku,Toei Japanese Language Institute,4・7・10・1,"6-18-1 Minami-Nagasaki, Toshima-ku, Tokyo 171-0052",+81-3-3954-1146,http://www.toeigakuin.jp,info@toeigakuin.jp
Tokyo,Toshima-ku,Japan College of Foreign Language Japanese Language Division,4・10,"5-18-17 Mejiro, Toshima-ku, Tokyo 171-0031",+81-3-5996-5411,http://www.jcfl.ac.jp/nihongo,jcmejiro@nifty.com
Tokyo,Toshima-ku,Asia International Language Center,4・7・10・1,"Komagome Little Bldg., 3-2-7 Komagome, Toshima-ku, Tokyo 170-0003",+81-45-680-6866,http://ailc.asia/,info@ailc.asia
Tokyo,Toshima-ku,"Tokyo Institute of Language, Japanese Language Center",7・10・1,"3-26-16 Ikebukuro, Toshima-ku, Tokyo 171-0014",+81-3-3986-4447,http://www.j-study.net,info@j-study.net
Tokyo,Toshima-ku,International Conversation Academy (ICA),7・10・1,"Maruei Bldg. 5F, 3-22-13 Nishi-Ikebukuro, Toshima-ku, Tokyo 171-0021",+81-3-3984-2476,http://www.aikgroup.co.jp/ica/,ica@aikgroup.co.jp
Tokyo,Toshima-ku,International School of Business,4・10,"3-8-1 Sugamo, Toshima-ku, Tokyo 170-0002 (Main campus)",+81-3-3949-7811,http://www.isb.ac.jp,tokyodream@isb.ac.jp
Tokyo,Toshima-ku,An Language School,7・10・1,"2-41-19 Minami-Ikebukuro, Toshima-ku, Tokyo 171-0022",+81-3-3989-0007,http://www.anschool.net,an@anschool.net
Tokyo,Toshima-ku,Meros Language School,7・10・1,"2-45-7 Higashi-Ikebukuro, Toshima-ku, Tokyo 170-0013",+81-3-3980-0068,http://www.meros.jp,info@meros.com
Tokyo,Toshima-ku,Sunshine College,4,"4-23-1 Higashi-Ikebukuro, Toshima-ku, Tokyo 170-8434",+81-3-3982-4281,http://www.tokyo-fukushi.ac.jp/english/en_index.html,-
Tokyo,Toshima-ku,Tokyo Language Center,-,"3-10-12 Takada, Toshima-ku, Tokyo 171-0033",+81-3-5287-4690,NONE,tlc@tokyolc.jp
Tokyo,Toshima-ku,International Academy Japanese Language Institute,7・10・1,"3-28-1 Ikebukuro, Toshima-ku, Tokyo 171-0014",+81-3-5953-3400,http://www.ksa-ikebukuro.com/,info@ksa-ikebukuro.com
Tokyo,Toshima-ku,Sendagaya Japanese School,4・10,"3-18-14 Takada, Toshima-ku, Tokyo 171-0033",+81-3-3987-7001,http://www.jp-sjs.ac.jp/,sendagaya@jp-sjs.ac.jp
Tokyo,Toshima-ku,Toshima Japanese Language Institute,4・10,"1-13-11 Komagome, Toshima-ku, Tokyo 170-0003",+81-3-3942-7001,-,-
Tokyo,Nakano-ku,Tokyo Nakano Language School,7・10・1,"1-27-3 Yayoi-cho, Nakano-ku, Tokyo 164-0013",+81-3-5304-5250,http://www.tnls.net,info@tnls.net
Tokyo,Nakano-ku,International Culture School of Foreign Language,4・10,"Kokusai Jinbun Bldg., 3-26-13 Minamidai, Nakano-ku, Tokyo 164-0014",+81-3-5340-8524,http://ashjb.com,jb1988@world.odn.ne.jp
Tokyo,Nakano-ku,Tokyo Nakano Language School,7・10・1,"1-27-3 Yayoi-cho, Nakano-ku, Tokyo 164-0013",+81-3-5304-5250,http://www.tnls.net,info@tnls.net
Tokyo,Nakano-ku,TCC Japanese Institute,7・10・1,"Dai 5 Sakae Bldg., 5-28-4 Arai, Nakano-ku, Tokyo 165-0026",+81-3-3388-6728,http://www.tcc-ji.com/,tcc-ji@tcc-ji.com
Tokyo,Nakano-ku,East West Japanese Language Institute,4・10,"2-36-9 Chuo, Nakano-ku, Tokyo 164-0011",+81-3-3366-4717,http://www.eastwest.ac.jp/eastwest,info@eastwest.ac.jp
Tokyo,Nakano-ku,Tokyo Japanese Language  and  Culture College,4・10,"4-6-6 Higashi-Nakano, Nakano-ku, Tokyo 164-0003",+81-3-3360-4771,http://www.trajal.ac.jp/jlc/,jlc@trajal.ac.jp
Tokyo,>Chiyoda-ku,OHARA Japanese Language School,7・10・1,"4-4-6 Iidabashi, Chiyoda-ku, Tokyo 102-0072",+81-3-3262-0390,http://jls.o-hara.ac.jp,JLS@o-hara.ac.jp
Tokyo,Chiyoda-ku,YMCA Asian Language Institute Japanese Language School,7・10・1,"2-5-5 Sarugaku-cho, Chiyoda-ku, Tokyo 101-0064",+81-3-3233-0615,http://www.ymcajapan.org/ayc/nihongo/EN/EN_regular_course.html,ayc@ymcajapan.org
Tokyo,Chiyoda-ku,Kyoritsu Foundation Japanese Language Academy,4・10,"6-13-2 Kanda, Chiyoda-ku, Tokyo 101-0021",+81-3-5846-7580,http://www.kif-org.com/naj/,infom1@naj-ac.jp
Tokyo,Chiyoda-ku,Kokusai Gaigogakuin,7・10・1,"2-1-9 Higashi-Kanda, Chiyoda-ku, Tokyo 101-0031",+81-3-5687-1578,http://ifls.jp,kokusai@cronos.ocn.ne.jp
Tokyo,Chiyoda-ku,Chiyoda International Language Academy,7・10・1,"2-13-12 Iwamoto-cho, Chiyoda-ku, Tokyo 101-0032",+81-3-3865-0818,http://www.cila.jp,info@cila.jp
Tokyo,Chiyoda-ku,Kudan Institute of Language  and  Culture,7・10・1,"Sunlight Bldg. 3F, 3-2-1 Kanda-Jinbo-cho, Chiyoda-ku, Tokyo 101-0051",+81-3-3239-7923,info@geos-japanese-insti.co.jp,info@kilc.co.jp
Tokyo,Suginami-ku,TOPA 21st Century Language School,7・10・1,"1-21-3 Koenji-Kita, Suginami-ku, Tokyo 166-0002",+81-3-5380-5011,http://www.topa21.co.jp,office@topa21.co.jp
Tokyo,Suginami-ku,Shinwa Gaigo Academy,4・7・10・1,"2-14-16 Shimo-Igusa, Suginami-ku, Tokyo 167-0022",+81-3-3390-8543,http://www.geocities.jp/jshinwa/,jshinwa@ybb.ne.jp
Tokyo,Suginami-ku,Tokyo Noah Language School,4・7・10・1,"3-49-9 Horinouchi, Suginami-ku, Tokyo 166-0013",+81-3-3315-8511,http://www.tokyonoah.com,tokyo.noa@jcom.home.ne.jp
Tokyo,Suginami-ku,Tokyo Sanritsu Academy,4・7・10,"1-3-14 Kami-Takaido, Suginami-ku, Tokyo 168-0074",+81-3-3304-4560,office@tokyo-sanritsu.jp,http://www.tokyo-sanritsu.jp
Tokyo,Suginami-ku,Gendai Language School,4・10,"1-25-15 Hon-Amanuma, Suginami-ku, Tokyo 167-0031",+81-3-3399-4366,http://www.gendai813.com/,contact@gendai813.com
Tokyo,Bunkyo-ku,"Takushoku University, Intensive Japanese Language Program for Overseas Students",4,"1-7-1 Otsuka, Bunkyo-ku, Tokyo 112-0012",+81-3-3947-8079,http://www.takushoku-u.ac.jp/english/index.html,web_adm@ofc.takushoku-u.ac.jp
Tokyo,Bunkyo-ku,The Institute of Japanese-Chinese Studies,4,"1-5-3 Koraku, Bunkyo-ku, Tokyo 112-0004",+81-3-3814-3591,http://www.rizhong.org/,info@rizhong.org
Tokyo,Bunkyo-ku,Hongo Language School,4・10,"2-4-8 Yushima, Bunkyo-ku, Tokyo 113-0034",+81-3-5803-7199,-,-
Tokyo,Bunkyo-ku,"Japanese Language Institute, Asian Students Cultural Association",7・10・1,"2-12-13 Honkomagome, Bunkyo-ku, Tokyo 113-0021",+81-3-3946-2171,http://www.abk.or.jp,nihongo@abk.or.jp
Tokyo,Taito-ku,Tamagawa International Language School Culture Department,4・7・10・1,"Tamagawa International Bldg., 5-15-10 Asakusabashi, Taito-ku, Tokyo 111-0053",+81-3-3861-8710,http://www.tils.co.jp,info@tils.ac.jp
Tokyo,Taito-ku,Tamagawa International Language School,4・7・10・1,"Tamagawa International Bldg., 5-15-10 Asakusabashi, Taito-ku, Tokyo 111-0053",+81-3-3861-8201,http://www.tils.co.jp,info@tils.co.jp
Tokyo,Taito-ku,Aisei Institute of Education,4・10,"3-21-7 Asakusabashi, Taito-ku, Tokyo 111-0053",+81-3-6904-3767,http://aiseikyoikugakuen.rakurakuhp.com,aisei_kyoikugakuen@yahoo.co.jp
Tokyo,Taito-ku,Inter-Cultural Institute of Japan,4・7・10・1,"2-20-9 Taito, Taito-ku, Tokyo 110-0016",+81-3-5816-4861,http://www.incul.com,incul@incul.com
Tokyo,Taito-ku,LIC Kokusai Gakuin,4・7・10・1,"4-1-11 Higasi-Ueno, Taito-ku, Tokyo 110-0015",+81-3-5830-8305,http://www.lic.home-world.net,info@lic.home-world.net
Tokyo,Taito-ku,Tokyo Riverside School,-,"Sunny Bldg. 2-2-5 Hanakawado, Taito-ku, Tokyo 111-0033",+81-3-3847-4871,http://www.tokyoriverside.co.jp,japanese-school@tokyoriverside.co.jp
Tokyo,Taito-ku,Tokyo International Business College,4・10,"2-7-5 Yanagibashi, Taito-ku, Tokyo 111-0052",+81-3-5825-8338,http://www.tibc.jp,info@tibc.jp
Tokyo,Taito-ku,Tokyo International Culture Education Institute,4・7・10,"2-13-2 Kuramae, Taito-ku, Tokyo 111-0051",+81-3-3861-4511,http://www.tokyo-icei.jp,ticei@tokyo-icei.jp
Tokyo,Taito-ku,Waseda Bunka Kan Nihongoka,4・7・10・1,"Waseda Bunka-kan Bldg., 2-18-9 Yanagibashi, Taito-ku, Tokyo 111-0052",+81-3-3863-4111,http://waseda-jp.org/,info@waseda-jp.org
Tokyo,Edogawa-ku,Tokyo Language Education Academy,4・7・10・1,"5-23-7 Hirai, Edogawa-ku, Tokyo 132-0035",+81-3-5631-5601,http://www.tokyolea.jp,tokyolea@tokyolea.jp
Tokyo,Edogawa-ku,Jishugakkan Japanese Language Institute,4・7・10・1,"2-1-22 Mizue, Edogawa-ku, Tokyo 132-0011",+81-3-3679-3813,http://www1.ocn.ne.jp/~jsg/,jishu08@guitar.ocn.ne.jp
Tokyo,Edogawa-ku,Tokyo International Asahi Institute,4・7・10・1,"1-7-8 Higashi-Kasai, Edogawa-ku, Tokyo 134-0084",+81-3-5679-8491,-,marimoriasahi@ybb.ne.jp
Tokyo,Edogawa-ku,Toho International College,4・7・10・1,"5-15-2 Higashi-Kasai, Edogawa-ku, Tokyo 134-0084",+81-3-3878-9630,http://www.toho-ac.jp/,toho-tokyo@mba.nifty.com
Tokyo,Edogawa-ku,Toyo Language School,4・7・10・1,"8-3-13 Nishi-Kasai, Edogawa-ku, Tokyo 134-0088",+81-3-5605-6211,http://www.tls-japan.com,info@tls-japan.com
Tokyo,Edogawa-ku,Tokyo Masuda Japanese Language School,4・10,"4-13-4 Hirai, Edogawa-ku, Tokyo 132-0035",+81-3-3685-8555,http://home.interlink.or.jp/~au-tmc/,au-tmc@interlink.or.jp
Tokyo,Edogawa-ku,Koiwa International Language School,-,"2-3-4 Kita-Koiwa, Edogawa-ku, Tokyo 133-0051",+81-3-5622-2345,-,info@koiwa-ils.co.jp
Tokyo,Meguro-ku,Evergreen Language School,4・7・10・1,"1-21-18 Yutenji, Meguro-ku, Tokyo 153-0052",+81-3-3713-4958,http://www.evergreen.gr.jp/,info@evergreen.gr.jp
Tokyo,Meguro-ku,New Global Language School,4・7・10・1,"1-7-10 Ohashi, Meguro-ku, Tokyo 153-0044",+81-3-3770-6071,http://www.newglobal.co.jp/school,school@newglobal.co.jp
Tokyo,Meguro-ku,Gregg International College Japanese Language Seminar,-,"1-14-6 Jiyugaoka, Meguro-ku, Tokyo 152-0035",+81-3-3724-0551,http://www.gregg.ac.jp,jyugaoka@gregg.ac.jp
Tokyo,Kita-ku,A. T. I. Tokyo Japanese Language School,4・7・10・1,"CT Bldg., 1-27-12 Tabata-Shin-cho, Kita-ku, Tokyo 114-0012",+81-3-5692-1900,http://www.atijls.com,ati@mint.ocn.ne.jp
Tokyo,Kita-ku,JET Academy,4・10,"3, 4F, 7-8-9 Takinogawa, Kita-ku, Tokyo 114-0023",+81-3-3916-2101,http://jet.ac.jp/,info@jet.ac.jp
Tokyo,Kita-ku,Japanese Language School of the Tokyo Foreign Language Academy,4・7・10・1,"3-19-21 Ukima, Kita-ku, Tokyo 115-0051",+81-3-3966-8910,http://www.tgn.ac.jp,office@tgn.ac.jp
Tokyo,Kita-ku,System Toyo Gaigo,4・7・10・1,"1-6-6 Higashi-Tabata, Kita-ku, Tokyo 114-0013",+81-3-3810-5490,http://www.systemtoyo.com,123@systemtoyo.com
Tokyo,Kita-ku,Asia Fellowship Society Japanese Language School,4・7・10・1,"2-23-4 Oji, Kita-ku, Tokyo 114-0002",+81-3-5390-3267,http://www.asiatomo.com.cn/,asiatomo@saturn.plala.or.jp
Tokyo,Katsushika-ku,TIJ Tokyo Institute of Japanese,4・10,"1-17-10 Shin-Koiwa, Katsushika-ku, Tokyo 124-0024",+81-3-5607-4100,http://www.tij.ne.jp,tij@tij.ne.jp
Tokyo,Katsushika-ku,Joto Japanese School,4・10,"1-26-15 Nishi-Kameari, Katsushika-ku, Tokyo 124-0002",+81-3-3604-1150,http://www5.ocn.ne.jp/~joto/,joto@crocus.ocn.ne.jp
Tokyo,Katsushika-ku,Hana International Academy,4・7・10・1,"1-6-12 Ohanachaya, Katsushika-ku, Tokyo 124-0003",+81-3-3603-2400,http://www.hanaacademy.com,academy@hanaacademy.com
Tokyo,Katsushika-ku,Sun-A International Academy,4・10,"1-33-9 Shin-Koiwa, Katsushika-ku, Tokyo 124-0024",+81-3-3651-0801,http://www.sun-A-tokyo.jp,info@sun-a-tokyo.jp
Tokyo,Koto-ku,Tokyo JE Language School,4・7・10・1,"2-19-2 Kiba, Koto-ku, Tokyo 135-0042",+81-3-5602-9771,http://tokyoje.sub.jp,tokyoje@gl.sub.jp
Tokyo,Koto-ku,Shurin College of Foreign Languages,4・10,"3-4-7 Ojima, Koto-ku, Tokyo 136-0072",+81-3-3638-7511,http://shurin.ac.jp,info@shurin.ac.jp
Tokyo,Koto-ku,Tokyo Nihonbashi Institute of Foreign Language,4・7・10・1,"2-34-11 Ningyo-cho, Nihonbashi, Chuo-ku, Tokyo 103-0013",+81-3-3666-8866,http://yieatokyo.com/,info@yieatokyo.com
Tokyo,Koto-ku,Kinoshita Campus Japanese Language School,4・7・10・1,"Kinoshita Bldg., 4-2-4 Oshima, Koto-ku, Tokyo 136-0072",+81-3-5609-3512,knst-1@knstschool.com,http://www.knstschool.com
Tokyo,Arakawa-ku,International Education Culture Center,4・7・10・1,"Ooba Bldg. 2F, 5-16-2 Nishi-Nippori, Arakawa-ku, Tokyo 116-0013",+81-3-3802-2193,http://www.ieccschool.com,ieccnippori@ybb.ne.jp
Tokyo,Arakawa-ku,Dynamic Business College,4・7・10・1,"2-51-8 Nishi-Nippori, Arakawa-ku, Tokyo 116-0013",+81-3-3802-8810,http://www.dbcjapan.com,dbc-k@d-b-c.co.jp
